{
    "metadata": {
        "NOMOR": "CP20DJFAJ004-2500173",
        "PRODUCT CATEGORY": "RICE",
        "BRAND": "FORTUNE",
        "CHANNEL": "GT",
        "REGION": "KC0011 - BMW HO JAKARTA",
        "SUB REGION": "KC001102 - LAMPUNG",
        "DISTRIBUTOR": "20DJFAJ004 - CV. Fajar Lestari Pekalongan",
        "PROMO TYPE": "31. DISCOUNT PROMO - 31. DISCOUNT PROMO",
        "SUB PROMO TYPE": "31C - STRATA DISCOUNT",
        "MECHANISM": "'1. claim DCV dengan dokumen pendukung nya\n'2. PL 1 jULI 2024Belum Bosnet",
        "REF DOC": "APP-KC1102-20DJFAJ004-25-00000243",
        "REF CP NO": "-",
        "PERIODE CP": "04/03/2025 - 15/03/2025",
        "GROUP OUTLET": "",
        "COMPENSATION": "",
        "TIPE CP": "CLAIM",
        "TIPE CLAIM": "DISTRIBUTOR",
        "CLAIM BASED": "SELLING - OUT\nMECHANISM: '1. claim DCV dengan dokumen pendukung nya\n'2. PL 1 jULI 2024Belum Bosnet\nDISCOUNT PROMOTION\nDISC % Additional Disc % CUT PRICE\nPRICE LIST SHARE\nSKU UOM RBP DIST STRATA RBP STORE RBP NET INC PPN\nSATP DIST %\nREG IOM OTH D 1 D 2 D 3 D 4 D 5 OTB PF\nFORTUNE PREMIUM\nCTN1/BAG 73.900,00 - - - 73.900,00 ✔ 3,44 - - - - 0,00 0,00 71.357,84 0,50 71.001,05\nRICE @5KG\nFORTUNE PREMIUM\nCTN1/BAG 147.800,00 - - - 147.800,00 ✔ 4,12 - - - - 0,00 0,00 141.710,64 0,50 141.002,09\nRICE @10KG\nSTRATA DISCOUNT TABLE\nCUT PRICE\nSHARE\nSKU UOM MIN QTY / CTN DISC % RBP STORE OFF INV RBP NET INC PPN\nDIST %\nOTB PF\n'5/0 2,76 71.860,36 0,00 71.501,06\nFORTUNE PREMIUM\nCTN1/BAG - 0,50\nRICE @5KG\n'10/0 3,44 71.357,84 0,00 71.001,05\n'1/0 3,44 142.715,68 0,00 142.002,10\nFORTUNE PREMIUM\nCTN1/BAG - 0,50\nRICE @10KG\n'3/0 4,12 141.710,64 0,00 141.002,09\nPRODUCT PROMOTION\nSKU UOM RBP DIST Price\nMIX QTY IN\nSTRATA SKU BONUS DESCRIPTION (CBP/RBP/ UOM TOTAL BUDGET\nITEM PCS\nDBP/Cost)\nFORTUNE PREMIUM\nCTN1/BAG 73.900,00 0,00 0 0,00\nRICE @5KG\nFORTUNE PREMIUM\nCTN1/BAG 147.800,00 0,00 0 0,00\nRICE @10KG\nSALES COMITMENT\nTOTAL EST BUDGET\nSKU TOTAL DISCOUNT TOTAL PRODUCT PROMO TOTAL OTB TOTAL PF\nPROMO\nQTY IN CTN VALUE\nFORTUNE PREMIUM\n200/0 14.271.568,00 508.600,00 0,00 - - 508.600,00\nRICE @5KG\nFORTUNE PREMIUM\n25/0 3.542.766,00 152.250,00 0,00 - - 152.250,00\nRICE @10KG\nPREPARED BY\nNUGRAHA PUTRA\nAPPROVED BY\n*APPROVED BY PT. SARI AGROTAMA PERSADA (SATP)"
    },
    "tables": [
        [
            {
                "product": "DISCOUNT PROMOTION",
                "UOM": null,
                "price_list": null,
                "DISC % REG": null,
                "DISC % IOM": null,
                "RBP DIST": null,
                "Additional Disc % D 1": null,
                "CUT PRICE OTB": null
            },
            {
                "product": "SKU",
                "UOM": "UOM",
                "price_list": "PRICE LIST\nSATP",
                "DISC % REG": "DISC %",
                "DISC % IOM": null,
                "RBP DIST": null,
                "Additional Disc % D 1": "RBP DIST",
                "CUT PRICE OTB": "STRATA"
            },
            {
                "product": null,
                "UOM": null,
                "price_list": null,
                "DISC % REG": "REG",
                "DISC % IOM": "IOM",
                "RBP DIST": "OTH",
                "Additional Disc % D 1": null,
                "CUT PRICE OTB": null
            },
            {
                "product": "FORTUNE PREMIUM\nRICE @5KG",
                "UOM": "CTN1/BAG",
                "price_list": "73.900,00",
                "DISC % REG": "-",
                "DISC % IOM": "-",
                "RBP DIST": "-",
                "Additional Disc % D 1": "73.900,00",
                "CUT PRICE OTB": "✔"
            },
            {
                "product": "FORTUNE PREMIUM\nRICE @10KG",
                "UOM": "CTN1/BAG",
                "price_list": "147.800,00",
                "DISC % REG": "-",
                "DISC % IOM": "-",
                "RBP DIST": "-",
                "Additional Disc % D 1": "147.800,00",
                "CUT PRICE OTB": "✔"
            },
            {
                "product": "STRATA DISCOUNT TABLE",
                "UOM": null,
                "price_list": null,
                "DISC % REG": null,
                "DISC % IOM": null,
                "RBP DIST": null,
                "Additional Disc % D 1": null,
                "CUT PRICE OTB": null
            },
            {
                "product": "SKU",
                "UOM": "UOM",
                "price_list": "MIN QTY / CTN",
                "DISC % REG": "DISC %",
                "DISC % IOM": "RBP STORE OFF INV",
                "RBP DIST": "CUT PRICE",
                "Additional Disc % D 1": null,
                "CUT PRICE OTB": "SHARE\nDIST %"
            },
            {
                "product": null,
                "UOM": null,
                "price_list": null,
                "DISC % REG": null,
                "DISC % IOM": null,
                "RBP DIST": "OTB",
                "Additional Disc % D 1": "PF",
                "CUT PRICE OTB": null
            },
            {
                "product": "FORTUNE PREMIUM\nRICE @5KG",
                "UOM": "CTN1/BAG",
                "price_list": "'5/0",
                "DISC % REG": "2,76",
                "DISC % IOM": "71.860,36",
                "RBP DIST": "0,00",
                "Additional Disc % D 1": "-",
                "CUT PRICE OTB": "0,50"
            },
            {
                "product": null,
                "UOM": null,
                "price_list": "'10/0",
                "DISC % REG": "3,44",
                "DISC % IOM": "71.357,84",
                "RBP DIST": "0,00",
                "Additional Disc % D 1": null,
                "CUT PRICE OTB": null
            },
            {
                "product": "FORTUNE PREMIUM\nRICE @10KG",
                "UOM": "CTN1/BAG",
                "price_list": "'1/0",
                "DISC % REG": "3,44",
                "DISC % IOM": "142.715,68",
                "RBP DIST": "0,00",
                "Additional Disc % D 1": "-",
                "CUT PRICE OTB": "0,50"
            },
            {
                "product": null,
                "UOM": null,
                "price_list": "'3/0",
                "DISC % REG": "4,12",
                "DISC % IOM": "141.710,64",
                "RBP DIST": "0,00",
                "Additional Disc % D 1": null,
                "CUT PRICE OTB": null
            },
            {
                "product": "SKU",
                "UOM": "UOM",
                "price_list": "RBP DIST",
                "DISC % REG": "PRODUCT PROMOTION",
                "DISC % IOM": null,
                "RBP DIST": null,
                "Additional Disc % D 1": null,
                "CUT PRICE OTB": null
            },
            {
                "product": null,
                "UOM": null,
                "price_list": null,
                "DISC % REG": "MIX\nITEM",
                "DISC % IOM": "STRATA",
                "RBP DIST": "SKU BONUS",
                "Additional Disc % D 1": "DESCRIPTION",
                "CUT PRICE OTB": "Price\n(CBP/RBP/\nDBP/Cost)"
            },
            {
                "product": "FORTUNE PREMIUM\nRICE @5KG",
                "UOM": "CTN1/BAG",
                "price_list": "73.900,00",
                "DISC % REG": "",
                "DISC % IOM": "",
                "RBP DIST": "",
                "Additional Disc % D 1": "",
                "CUT PRICE OTB": "0,00"
            },
            {
                "product": "FORTUNE PREMIUM\nRICE @10KG",
                "UOM": "CTN1/BAG",
                "price_list": "147.800,00",
                "DISC % REG": "",
                "DISC % IOM": "",
                "RBP DIST": "",
                "Additional Disc % D 1": "",
                "CUT PRICE OTB": "0,00"
            },
            {
                "product": "SKU",
                "UOM": "SALES COMITMENT",
                "price_list": null,
                "DISC % REG": "TOTAL DISCOUNT",
                "DISC % IOM": "TOTAL PRODUCT PROMO",
                "RBP DIST": "TOTAL OTB",
                "Additional Disc % D 1": "TOTAL PF",
                "CUT PRICE OTB": "TOTAL EST BUDGET\nPROMO"
            },
            {
                "product": null,
                "UOM": "QTY IN CTN",
                "price_list": "VALUE",
                "DISC % REG": null,
                "DISC % IOM": null,
                "RBP DIST": null,
                "Additional Disc % D 1": null,
                "CUT PRICE OTB": null
            },
            {
                "product": "FORTUNE PREMIUM\nRICE @5KG",
                "UOM": "200/0",
                "price_list": "14.271.568,00",
                "DISC % REG": "508.600,00",
                "DISC % IOM": "0,00",
                "RBP DIST": "-",
                "Additional Disc % D 1": "-",
                "CUT PRICE OTB": "508.600,00"
            },
            {
                "product": "FORTUNE PREMIUM\nRICE @10KG",
                "UOM": "25/0",
                "price_list": "3.542.766,00",
                "DISC % REG": "152.250,00",
                "DISC % IOM": "0,00",
                "RBP DIST": "-",
                "Additional Disc % D 1": "-",
                "CUT PRICE OTB": "152.250,00"
            }
        ]
    ]
}